# name: test/storage/attach_existing_enum.test
# description:
# group: [postgres_storage]

require postgres_scanner

statement ok
ATTACH 'dbname=postgresscanner' AS s (TYPE POSTGRES)

statement ok
USE s;

query I
SELECT * FROM pg_enumarraytypes
----
[]
[foo]
[foo, bar]
[foo, bar, baz]
[foo, bar, baz, NULL]
NULL

statement ok
BEGIN

statement ok
DELETE FROM pg_enumarraytypes

query I
INSERT INTO pg_enumarraytypes VALUES ([]), (['foo']), (['foo', 'bar']), (['foo', 'bar', 'baz']), (['foo', 'bar', 'baz', NULL]), (NULL);
----
6

statement ok
COMMIT

query I
SELECT * FROM pg_enumarraytypes
----
[]
[foo]
[foo, bar]
[foo, bar, baz]
[foo, bar, baz, NULL]
NULL
