# name: test/sql/storage/attach_views.test
# description: Test attaching, creating and querying views
# group: [storage]

require postgres_scanner

require-env POSTGRES_TEST_DATABASE_AVAILABLE

statement ok
PRAGMA enable_verification

statement ok
ATTACH 'dbname=postgresscanner' AS s (TYPE POSTGRES)

statement ok
USE s;

statement ok
DROP VIEW IF EXISTS v1

statement ok
CREATE VIEW v1 AS SELECT 42 AS i;

query I
SELECT i FROM v1
----
42

statement error
CREATE VIEW v1 AS SELECT 84;
----
already exists

statement error
INSERT INTO v1 VALUES (42);
----
cannot copy to view

# FIXME - error message here is not very descriptive
statement error
UPDATE v1 SET i=84
----

statement error
DELETE FROM v1
----

statement error
INSERT INTO v1 VALUES (1, 1);
----
table v1 has 1 columns but 2 values were supplied

statement ok
CREATE VIEW IF NOT EXISTS v1 AS SELECT 84;

statement ok
CREATE OR REPLACE VIEW v1 AS SELECT 84;

query I
SELECT * FROM v1
----
84

statement error
DROP TABLE v1
----
not a table

statement ok
DROP VIEW v1

statement error
SELECT * FROM v1
----
Table with name v1 does not exist

statement error
DROP VIEW v1
----
View with name v1 does not exist

statement ok
CREATE VIEW v1(a) AS SELECT 99;

query I
SELECT a FROM v1
----
99

# special names
statement ok
CREATE OR REPLACE VIEW "table "" table '' table"("column "" column '' column") AS SELECT 3

query I
SELECT "column "" column '' column" FROM "table "" table '' table"
----
3
