# name: test/sql/storage/attach_case_sensitive_columns.test
# description: Test for table with names that differ only in case
# group: [storage]

require postgres_scanner

require-env POSTGRES_TEST_DATABASE_AVAILABLE

statement ok
PRAGMA enable_verification

statement ok
ATTACH 'dbname=postgresscanner' AS s (TYPE POSTGRES)

query II
SELECT * FROM s.tbl_with_case_sensitive_columns
----
42	84

query II
SELECT MyColumn, "MyColumn_1" FROM s.tbl_with_case_sensitive_columns
----
42	84

statement ok
BEGIN

statement ok
DELETE FROM s.tbl_with_case_sensitive_columns

statement ok
INSERT INTO s.tbl_with_case_sensitive_columns (MyColumn, "MyColumn_1") VALUES (42, 43);

statement ok
COMMIT

query II
SELECT MyColumn, "MyColumn_1" FROM s.tbl_with_case_sensitive_columns
----
42	43

statement ok
UPDATE s.tbl_with_case_sensitive_columns SET "MyColumn_1"=84

query II
SELECT MyColumn, "MyColumn_1" FROM s.tbl_with_case_sensitive_columns
----
42	84
