# name: test/sql/storage/attach_types_json.test
# description: Test inserting/querying json/jsonb
# group: [storage]

require postgres_scanner

statement ok
ATTACH 'dbname=postgresscanner' AS s (TYPE POSTGRES)

statement ok
USE s;

query II
SELECT * FROM pg_json
----
{"a": 42, "b": "string"}

statement ok
DELETE FROM pg_json

statement ok
INSERT INTO pg_json VALUES ('{"a": 42, "b": "string"}')

query II
SELECT * FROM pg_json
----
{"a": 42, "b": "string"}
