# name: test/sql/storage/attach_existing_multidimensional_array.test
# description: Test querying multidimensional arrays that were previously defined
# group: [storage]

require postgres_scanner

require-env POSTGRES_TEST_DATABASE_AVAILABLE

statement ok
PRAGMA enable_verification

statement ok
ATTACH 'dbname=postgresscanner' AS s (TYPE POSTGRES)

statement ok
USE s;

query II
SELECT * FROM many_multidimensional_arrays
----
[[[1, 2, 3]], [[4, 5, 6]], [[7, 8, 9]]]	[[hello world, abc], [this is, an array]]

statement ok
UPDATE many_multidimensional_arrays SET i=[[[1, 2]], [[4, 5]], [[7, 8]]]

query II
SELECT * FROM many_multidimensional_arrays
----
[[[1, 2]], [[4, 5]], [[7, 8]]]	[[hello world, abc], [this is, an array]]

statement ok
DELETE FROM many_multidimensional_arrays

statement ok
INSERT INTO many_multidimensional_arrays VALUES (
        ARRAY[ARRAY[[1, 2, 3]], ARRAY[[4, 5, 6]], ARRAY[[7, 8, 9]]],
        ARRAY[ARRAY['hello world', 'abc'], ARRAY['this is', 'an array']]);

query II
SELECT * FROM many_multidimensional_arrays
----
[[[1, 2, 3]], [[4, 5, 6]], [[7, 8, 9]]]	[[hello world, abc], [this is, an array]]

statement error
SELECT * FROM mixed_arrays
----
The array stored in Postgres does not match the schema

statement ok
SET pg_array_as_varchar=true

statement ok
CALL pg_clear_cache();

query I
SELECT * FROM mixed_arrays
----
{{{1,2,3}},{{4,5,6}},{{7,8,9}}}
{1,2,3}
